{"arkit":{"frame_semantics":["smoothedSceneDepth"],"scene_reconstruction":"meshWithClassification","video_format":{"fps":60,"height":1440,"width":1920},"world_alignment":"gravity"},"build":{"app_version":"0.1.0","eas_build_id":null,"git_commit":"e191db7c0a4b5d6e7f8091a2b3c4d5e6f7081920","profile":"synthetic"},"clocks":{"media_time_s":81234.5,"system_uptime_s":81234.5,"wall_clock":"2026-10-20T08:15:02.104+08:00"},"closed":true,"detector_versions":null,"device_model":"iPhone18,2","files":[{"bytes":1024,"path":"actions.jsonl","sha256":"3f2a9c4e8b1d7f6a0c5e2b9d4a7f1c8e6b3d0a9f5c2e7b4d1a8f6c3e0b9d2a7f"},{"bytes":1024,"path":"altitude.jsonl","sha256":"3f2a9c4e8b1d7f6a0c5e2b9d4a7f1c8e6b3d0a9f5c2e7b4d1a8f6c3e0b9d2a7f"},{"bytes":1024,"path":"anchors.jsonl","sha256":"3f2a9c4e8b1d7f6a0c5e2b9d4a7f1c8e6b3d0a9f5c2e7b4d1a8f6c3e0b9d2a7f"},{"bytes":1024,"path":"events.jsonl","sha256":"3f2a9c4e8b1d7f6a0c5e2b9d4a7f1c8e6b3d0a9f5c2e7b4d1a8f6c3e0b9d2a7f"},{"bytes":1024,"path":"frames.jsonl","sha256":"3f2a9c4e8b1d7f6a0c5e2b9d4a7f1c8e6b3d0a9f5c2e7b4d1a8f6c3e0b9d2a7f"},{"bytes":1024,"path":"imu.jsonl","sha256":"3f2a9c4e8b1d7f6a0c5e2b9d4a7f1c8e6b3d0a9f5c2e7b4d1a8f6c3e0b9d2a7f"},{"bytes":1024,"path":"location.jsonl","sha256":"3f2a9c4e8b1d7f6a0c5e2b9d4a7f1c8e6b3d0a9f5c2e7b4d1a8f6c3e0b9d2a7f"},{"bytes":1024,"path":"mesh/history.bin","sha256":"3f2a9c4e8b1d7f6a0c5e2b9d4a7f1c8e6b3d0a9f5c2e7b4d1a8f6c3e0b9d2a7f"},{"bytes":1024,"path":"mesh/history.jsonl","sha256":"3f2a9c4e8b1d7f6a0c5e2b9d4a7f1c8e6b3d0a9f5c2e7b4d1a8f6c3e0b9d2a7f"},{"bytes":1024,"path":"motion.jsonl","sha256":"3f2a9c4e8b1d7f6a0c5e2b9d4a7f1c8e6b3d0a9f5c2e7b4d1a8f6c3e0b9d2a7f"},{"bytes":1024,"path":"telemetry.jsonl","sha256":"3f2a9c4e8b1d7f6a0c5e2b9d4a7f1c8e6b3d0a9f5c2e7b4d1a8f6c3e0b9d2a7f"}],"motion":{"reference_frame":"xArbitraryCorrectedZVertical"},"origin":"synthetic","os_version":"iOS 26.7","profile":"lean","rates":{"candidates_hz":4.1,"frames_hz":59.6,"imu_hz":99.8,"mesh_interval_s":5.02,"motion_hz":99.8},"recording_id":"5d0c6f1e-3b7a-4f7e-9c51-2a8e4b6d1f03","recording_version":1,"segments":[{"capture_id":"8f9585da-8554-4b8a-ba4e-0f390ccd3802","end_t":211.4,"frame_offset":0,"kept":true,"manifest_sha256":"3f2a9c4e8b1d7f6a0c5e2b9d4a7f1c8e6b3d0a9f5c2e7b4d1a8f6c3e0b9d2a7f","start_t":3.2}],"session_started_at":"2026-10-20T08:15:02+08:00","venues":["36632586-e1fa-4e10-800a-81acf0eab09a","dabbc03c-39d9-4947-8dbc-b2aa0c42e5d2"],"window":{"end_t":412.8,"ended":"end_anchor","start_t":3.2,"trimmed":false}}
